{
  "case_id": "2026-03-09_163750_75268",
  "random_seed": 981016840,
  "tags": [
    "exploit"
  ],
  "parent_ids": [
    "2026-03-06_022433_61367"
  ],
  "success": true,
  "total_score": Infinity,
  "iterations_used": 0,
  "walltime_sec": 422.98,
  "failure_reason": "",
  "failure_class": "",
  "metrics": {},
  "case_config": {
    "description": "Mutation: input.LandremanPaul2021_QA ncoils=3 order=4",
    "surface_params": {
      "surface": "input.LandremanPaul2021_QA",
      "range": "half period"
    },
    "coils_params": {
      "ncoils": 3,
      "order": 4
    },
    "optimizer_params": {
      "algorithm": "augmented_lagrangian",
      "max_iterations": 500,
      "verbose": true
    },
    "coil_objective_terms": {
      "total_length": "l2_threshold",
      "coil_curvature": "lp_threshold",
      "coil_curvature_p": 2,
      "coil_mean_squared_curvature": "l2_threshold",
      "coil_arclength_variation": "l2_threshold",
      "linking_number": "",
      "cc_threshold": 0.099028,
      "cs_threshold": 0.113438,
      "msc_threshold": 6.962262,
      "curvature_threshold": 2.574954,
      "flux_threshold": 1e-06,
      "force_threshold": 6.942595,
      "torque_threshold": 7.463232
    },
    "fourier_continuation": {
      "enabled": true,
      "orders": [
        4,
        8,
        16
      ]
    }
  }
}